-- Test: conflict statistics for UPDATE_MISSING conflicts (PG18+ only)
SELECT * FROM spock_regress_variables()
\gset
\c :provider_dsn
-- Create a simple table for conflict testing
SELECT spock.replicate_ddl($$
	CREATE TABLE public.conflict_stat_test (
		id integer PRIMARY KEY,
		data text
	);
$$);
 replicate_ddl 
---------------
 t
(1 row)

SELECT * FROM spock.repset_add_table('default', 'conflict_stat_test');
 repset_add_table 
------------------
 t
(1 row)

-- Seed initial rows
INSERT INTO conflict_stat_test VALUES (1, 'row1');
INSERT INTO conflict_stat_test VALUES (2, 'row2');
SELECT spock.wait_slot_confirm_lsn(NULL, NULL);
 wait_slot_confirm_lsn 
-----------------------
 
(1 row)

\c :subscriber_dsn
-- Get subscription OID for stats queries
SELECT sub_id AS test_sub_id FROM spock.subscription
	WHERE sub_name = 'test_subscription' \gset
-- Reset conflict stats before the test
SELECT spock.reset_subscription_stats(:test_sub_id);
 reset_subscription_stats 
--------------------------
 
(1 row)

-- Verify counters are zero initially
SELECT confl_update_missing,
  confl_insert_exists,confl_update_origin_differs,confl_update_exists,
  confl_delete_origin_differs,confl_delete_missing,confl_delete_exists
FROM spock.get_subscription_stats(:test_sub_id);
 confl_update_missing | confl_insert_exists | confl_update_origin_differs | confl_update_exists | confl_delete_origin_differs | confl_delete_missing | confl_delete_exists 
----------------------+---------------------+-----------------------------+---------------------+-----------------------------+----------------------+---------------------
                    0 |                   0 |                           0 |                   0 |                           0 |                    0 |                   0
(1 row)

-- Delete a row on subscriber only to set up UPDATE_MISSING
DELETE FROM conflict_stat_test WHERE id = 1;
TRUNCATE spock.exception_log;
\c :provider_dsn
-- Update the row that no longer exists on subscriber
UPDATE conflict_stat_test SET data = 'updated_row1' WHERE id = 1;
SELECT spock.wait_slot_confirm_lsn(NULL, NULL);
 wait_slot_confirm_lsn 
-----------------------
 
(1 row)

\c :subscriber_dsn
-- spock.missing_update_to_insert is on by default, so row id=1 is rebuilt
-- from the UPDATE and reinserted rather than skipped.
SELECT * FROM conflict_stat_test ORDER BY id;
 id |     data     
----+--------------
  1 | updated_row1
  2 | row2
(2 rows)

-- Resolved, so nothing lands in exception_log
SELECT operation, table_name FROM spock.exception_log;
 operation | table_name 
-----------+------------
(0 rows)

-- Verify that the UPDATE_MISSING conflict was counted
SELECT confl_update_missing,
  confl_insert_exists,confl_update_origin_differs,confl_update_exists,
  confl_delete_origin_differs,confl_delete_missing,confl_delete_exists
FROM spock.get_subscription_stats(:test_sub_id);
 confl_update_missing | confl_insert_exists | confl_update_origin_differs | confl_update_exists | confl_delete_origin_differs | confl_delete_missing | confl_delete_exists 
----------------------+---------------------+-----------------------------+---------------------+-----------------------------+----------------------+---------------------
                    1 |                   0 |                           0 |                   0 |                           0 |                    0 |                   0
(1 row)

-- Provoke a second UPDATE_MISSING to confirm counter increments
DELETE FROM conflict_stat_test WHERE id = 2;
TRUNCATE spock.exception_log;
\c :provider_dsn
UPDATE conflict_stat_test SET data = 'updated_row2' WHERE id = 2;
SELECT spock.wait_slot_confirm_lsn(NULL, NULL);
 wait_slot_confirm_lsn 
-----------------------
 
(1 row)

\c :subscriber_dsn
SELECT * FROM conflict_stat_test ORDER BY id;
 id |     data     
----+--------------
  1 | updated_row1
  2 | updated_row2
(2 rows)

-- Counter should now be 2
SELECT confl_update_missing,
  confl_insert_exists,confl_update_origin_differs,confl_update_exists,
  confl_delete_origin_differs,confl_delete_missing,confl_delete_exists
FROM spock.get_subscription_stats(:test_sub_id);
 confl_update_missing | confl_insert_exists | confl_update_origin_differs | confl_update_exists | confl_delete_origin_differs | confl_delete_missing | confl_delete_exists 
----------------------+---------------------+-----------------------------+---------------------+-----------------------------+----------------------+---------------------
                    2 |                   0 |                           0 |                   0 |                           0 |                    0 |                   0
(1 row)

-- Test reset: clear the stats and verify counter goes back to zero
SELECT spock.reset_subscription_stats(:test_sub_id);
 reset_subscription_stats 
--------------------------
 
(1 row)

-- ============================================================
-- UPDATE_MISSING with spock.missing_update_to_insert off: the row stays
-- missing and the UPDATE is raised, as it was before the conversion existed.
-- The counter increments either way -- the conflict is counted whether it is
-- resolved or raised.
-- ============================================================
ALTER SYSTEM SET spock.missing_update_to_insert = off;
SELECT pg_reload_conf();
 pg_reload_conf 
----------------
 t
(1 row)

DELETE FROM conflict_stat_test WHERE id = 1;
TRUNCATE spock.exception_log;
\c :provider_dsn
UPDATE conflict_stat_test SET data = 'off_row1' WHERE id = 1;
SELECT spock.wait_slot_confirm_lsn(NULL, NULL);
 wait_slot_confirm_lsn 
-----------------------
 
(1 row)

\c :subscriber_dsn
-- Row must NOT come back
SELECT * FROM conflict_stat_test WHERE id = 1;
 id | data 
----+------
(0 rows)

-- and the UPDATE must be logged as an exception
SELECT operation, table_name FROM spock.exception_log;
 operation |     table_name     
-----------+--------------------
 UPDATE    | conflict_stat_test
(1 row)

SELECT confl_update_missing
FROM spock.get_subscription_stats(:test_sub_id);
 confl_update_missing 
----------------------
                    1
(1 row)

ALTER SYSTEM RESET spock.missing_update_to_insert;
SELECT pg_reload_conf();
 pg_reload_conf 
----------------
 t
(1 row)

SELECT spock.reset_subscription_stats(:test_sub_id);
 reset_subscription_stats 
--------------------------
 
(1 row)

TRUNCATE spock.exception_log;
-- ============================================================
-- UPDATE_MISSING that cannot be converted even with the GUC on: a column
-- whose value is an unchanged TOAST pointer is not in the message, so the row
-- cannot be rebuilt.  It must fail rather than store a NULL in its place.
-- ============================================================
\c :provider_dsn
SELECT spock.replicate_ddl($$
	CREATE TABLE public.conflict_stat_toast (
		id integer PRIMARY KEY,
		small text,
		big text
	);
$$);
 replicate_ddl 
---------------
 t
(1 row)

SELECT spock.replicate_ddl($$
	ALTER TABLE public.conflict_stat_toast ALTER COLUMN big SET STORAGE EXTERNAL;
$$);
 replicate_ddl 
---------------
 t
(1 row)

SELECT * FROM spock.repset_add_table('default', 'conflict_stat_toast');
 repset_add_table 
------------------
 t
(1 row)

INSERT INTO conflict_stat_toast VALUES (1, 'small', repeat('x', 200000));
SELECT spock.wait_slot_confirm_lsn(NULL, NULL);
 wait_slot_confirm_lsn 
-----------------------
 
(1 row)

\c :subscriber_dsn
SELECT id, small, length(big) FROM conflict_stat_toast ORDER BY id;
 id | small | length 
----+-------+--------
  1 | small | 200000
(1 row)

DELETE FROM conflict_stat_toast WHERE id = 1;
TRUNCATE spock.exception_log;
\c :provider_dsn
-- 'big' is not touched, so it arrives as an unchanged TOAST pointer
UPDATE conflict_stat_toast SET small = 'changed' WHERE id = 1;
SELECT spock.wait_slot_confirm_lsn(NULL, NULL);
 wait_slot_confirm_lsn 
-----------------------
 
(1 row)

\c :subscriber_dsn
-- The row must not come back, and nothing may have a NULL big column
SELECT count(*) AS rows_back FROM conflict_stat_toast WHERE id = 1;
 rows_back 
-----------
         0
(1 row)

SELECT count(*) AS null_big FROM conflict_stat_toast WHERE big IS NULL;
 null_big 
----------
        0
(1 row)

SELECT operation, table_name FROM spock.exception_log;
 operation |     table_name      
-----------+---------------------
 UPDATE    | conflict_stat_toast
(1 row)

SELECT confl_update_missing
FROM spock.get_subscription_stats(:test_sub_id);
 confl_update_missing 
----------------------
                    1
(1 row)

SELECT spock.reset_subscription_stats(:test_sub_id);
 reset_subscription_stats 
--------------------------
 
(1 row)

TRUNCATE spock.exception_log;
-- ============================================================
-- Test INSERT_EXISTS: insert a row on subscriber, then insert the same key on
-- provider.  The apply worker detects the duplicate and resolves the conflict
-- (last_update_wins converts the insert into an update).
-- ============================================================
-- Re-seed rows so both sides have data again
\c :provider_dsn
INSERT INTO conflict_stat_test VALUES (10, 'provider10');
SELECT spock.wait_slot_confirm_lsn(NULL, NULL);
 wait_slot_confirm_lsn 
-----------------------
 
(1 row)

\c :subscriber_dsn
-- Pre-insert a conflicting row on the subscriber
INSERT INTO conflict_stat_test VALUES (20, 'sub-only');
TRUNCATE spock.exception_log;
\c :provider_dsn
-- This INSERT will conflict with the row already on subscriber
INSERT INTO conflict_stat_test VALUES (20, 'from-provider');
SELECT spock.wait_slot_confirm_lsn(NULL, NULL);
 wait_slot_confirm_lsn 
-----------------------
 
(1 row)

\c :subscriber_dsn
-- The row should now reflect the resolved value (remote wins)
SELECT * FROM conflict_stat_test WHERE id = 20;
 id |     data      
----+---------------
 20 | from-provider
(1 row)

-- Verify INSERT_EXISTS counter incremented
SELECT confl_insert_exists
FROM spock.get_subscription_stats(:test_sub_id);
 confl_insert_exists 
---------------------
                   1
(1 row)

SELECT spock.reset_subscription_stats(:test_sub_id);
 reset_subscription_stats 
--------------------------
 
(1 row)

-- ============================================================
-- Test DELETE_MISSING: delete a row on subscriber first, then delete the same
-- row on provider.  The apply worker cannot find the row and reports
-- DELETE_MISSING.
-- ============================================================
TRUNCATE spock.exception_log;
-- Remove the row on subscriber before provider sends its DELETE
DELETE FROM conflict_stat_test WHERE id = 10;
\c :provider_dsn
DELETE FROM conflict_stat_test WHERE id = 10;
SELECT spock.wait_slot_confirm_lsn(NULL, NULL);
 wait_slot_confirm_lsn 
-----------------------
 
(1 row)

\c :subscriber_dsn
-- Row should still be absent
SELECT * FROM conflict_stat_test WHERE id = 10;
 id | data 
----+------
(0 rows)

SELECT confl_update_missing,
  confl_insert_exists,confl_update_origin_differs,confl_update_exists,
  confl_delete_origin_differs,confl_delete_missing,confl_delete_exists
FROM spock.get_subscription_stats(:test_sub_id);
 confl_update_missing | confl_insert_exists | confl_update_origin_differs | confl_update_exists | confl_delete_origin_differs | confl_delete_missing | confl_delete_exists 
----------------------+---------------------+-----------------------------+---------------------+-----------------------------+----------------------+---------------------
                    0 |                   0 |                           0 |                   0 |                           0 |                    1 |                   0
(1 row)

SELECT spock.reset_subscription_stats(:test_sub_id);
 reset_subscription_stats 
--------------------------
 
(1 row)

-- ============================================================
-- Test UPDATE_EXISTS: an UPDATE from the provider violates a secondary
-- unique constraint on the subscriber.  The apply worker detects the
-- unique violation, logs update_exists to the PostgreSQL log, counts
-- it in conflict stats, and records it in exception_log.
-- Default exception_behaviour is TRANSDISCARD: the worker errors on
-- the first attempt, restarts, replays read-only logging each failing
-- row to exception_log, then advances the LSN.
-- ============================================================
\c :provider_dsn
-- Create a table with a secondary unique index
SELECT spock.replicate_ddl($$
	CREATE TABLE public.conflict_ue_test (
		id integer PRIMARY KEY,
		uval integer NOT NULL,
		data text
	);
	CREATE UNIQUE INDEX conflict_ue_test_uval_idx
		ON public.conflict_ue_test (uval);
$$);
 replicate_ddl 
---------------
 t
(1 row)

SELECT * FROM spock.repset_add_table('default', 'conflict_ue_test');
 repset_add_table 
------------------
 t
(1 row)

-- Seed rows on both sides via replication
INSERT INTO conflict_ue_test VALUES (1, 100, 'row1');
INSERT INTO conflict_ue_test VALUES (2, 200, 'row2');
SELECT spock.wait_slot_confirm_lsn(NULL, NULL);
 wait_slot_confirm_lsn 
-----------------------
 
(1 row)

\c :subscriber_dsn
-- Insert a row only on the subscriber to set up the conflict
INSERT INTO conflict_ue_test VALUES (3, 300, 'sub_only');
SELECT * FROM conflict_ue_test ORDER BY id;
 id | uval |   data   
----+------+----------
  1 |  100 | row1
  2 |  200 | row2
  3 |  300 | sub_only
(3 rows)

-- Reset stats
SELECT spock.reset_subscription_stats(:test_sub_id);
 reset_subscription_stats 
--------------------------
 
(1 row)

TRUNCATE spock.exception_log;
\c :provider_dsn
-- This UPDATE sets uval=300 on row id=2.  It succeeds on the provider
-- (no row with uval=300 here), but on the subscriber row id=3 already
-- has uval=300, so the secondary unique index is violated.
UPDATE conflict_ue_test SET uval = 300, data = 'should_conflict' WHERE id = 2;
SELECT spock.wait_slot_confirm_lsn(NULL, NULL);
 wait_slot_confirm_lsn 
-----------------------
 
(1 row)

\c :subscriber_dsn
-- Row id=2 should still have its original value (update was discarded)
SELECT * FROM conflict_ue_test ORDER BY id;
 id | uval |   data   
----+------+----------
  1 |  100 | row1
  2 |  200 | row2
  3 |  300 | sub_only
(3 rows)

-- The conflict should be logged in exception_log
SELECT operation, table_name FROM spock.exception_log;
 operation |    table_name    
-----------+------------------
 UPDATE    | conflict_ue_test
(1 row)

-- Verify UPDATE_EXISTS counter incremented
SELECT confl_update_exists
FROM spock.get_subscription_stats(:test_sub_id);
 confl_update_exists 
---------------------
                   1
(1 row)

SELECT spock.reset_subscription_stats(:test_sub_id);
 reset_subscription_stats 
--------------------------
 
(1 row)

TRUNCATE spock.exception_log;
-- Cleanup
\c :provider_dsn
SELECT spock.replicate_ddl($$ DROP TABLE public.conflict_ue_test CASCADE; $$);
NOTICE:  drop cascades to table conflict_ue_test membership in replication set default
 replicate_ddl 
---------------
 t
(1 row)

-- Cleanup original test table
TRUNCATE spock.exception_log;
SELECT spock.replicate_ddl($$ DROP TABLE public.conflict_stat_toast CASCADE; $$);
NOTICE:  drop cascades to table conflict_stat_toast membership in replication set default
 replicate_ddl 
---------------
 t
(1 row)

SELECT spock.replicate_ddl($$ DROP TABLE public.conflict_stat_test CASCADE; $$);
NOTICE:  drop cascades to table conflict_stat_test membership in replication set default
 replicate_ddl 
---------------
 t
(1 row)

