--Immutable, volatile functions and nextval in DEFAULT clause
SELECT * FROM spock_regress_variables()
\gset
\c :provider_dsn
SELECT spock.replicate_ddl($$
CREATE FUNCTION public.add(integer, integer) RETURNS integer
    AS 'select $1 + $2;'
    LANGUAGE SQL
    IMMUTABLE
    RETURNS NULL ON NULL INPUT;

CREATE TABLE public.funct2(
	a integer,
	b integer,
	c integer DEFAULT public.add(10,12 )
) ;
$$);
 replicate_ddl 
---------------
 t
(1 row)

SELECT * FROM spock.repset_add_table('default_insert_only', 'public.funct2');
 repset_add_table 
------------------
 t
(1 row)

SELECT spock.wait_slot_confirm_lsn(NULL, NULL);
 wait_slot_confirm_lsn 
-----------------------
 
(1 row)

INSERT INTO public.funct2(a,b) VALUES (1,2);--c should be 22
INSERT INTO public.funct2(a,b,c) VALUES (3,4,5);-- c should be 5
SELECT spock.wait_slot_confirm_lsn(NULL, NULL);
 wait_slot_confirm_lsn 
-----------------------
 
(1 row)

\c :subscriber_dsn
SELECT * from public.funct2;
 a | b | c  
---+---+----
 1 | 2 | 22
 3 | 4 |  5
(2 rows)

\c :provider_dsn
SELECT spock.replicate_ddl($$
create or replace function public.get_curr_century() returns double precision as
 'SELECT EXTRACT(CENTURY FROM NOW());'
language sql volatile;

CREATE TABLE public.funct5(
	a integer,
	b integer,
	c double precision DEFAULT public.get_curr_century()
);
$$);
 replicate_ddl 
---------------
 t
(1 row)

SELECT * FROM spock.repset_add_all_tables('default_insert_only', '{public}');
 repset_add_all_tables 
-----------------------
 t
(1 row)

SELECT spock.wait_slot_confirm_lsn(NULL, NULL);
 wait_slot_confirm_lsn 
-----------------------
 
(1 row)

INSERT INTO public.funct5(a,b) VALUES (1,2);--c should be e.g. 21 for 2015
INSERT INTO public.funct5(a,b,c) VALUES (3,4,20);-- c should be 20
SELECT spock.wait_slot_confirm_lsn(NULL, NULL);
 wait_slot_confirm_lsn 
-----------------------
 
(1 row)

\c :subscriber_dsn
SELECT * from public.funct5;
 a | b | c  
---+---+----
 1 | 2 | 21
 3 | 4 | 20
(2 rows)

--nextval check
\c :provider_dsn
SELECT spock.replicate_ddl($$
CREATE SEQUENCE public.INSERT_SEQ;

CREATE TABLE public.funct (
	a integer,
	b INT DEFAULT nextval('public.insert_seq')
);
$$);
 replicate_ddl 
---------------
 t
(1 row)

SELECT * FROM spock.repset_add_all_tables('default_insert_only', '{public}');
 repset_add_all_tables 
-----------------------
 t
(1 row)

SELECT spock.wait_slot_confirm_lsn(NULL, NULL);
 wait_slot_confirm_lsn 
-----------------------
 
(1 row)

INSERT INTO public.funct (a) VALUES (1);
INSERT INTO public.funct (a) VALUES (2);
INSERT INTO public.funct (a) VALUES (3);
SELECT spock.wait_slot_confirm_lsn(NULL, NULL);
 wait_slot_confirm_lsn 
-----------------------
 
(1 row)

\c :subscriber_dsn
SELECT * FROM public.funct;
 a | b 
---+---
 1 | 1
 2 | 2
 3 | 3
(3 rows)

\c :provider_dsn
BEGIN;
COMMIT;--empty transaction
SELECT spock.wait_slot_confirm_lsn(NULL, NULL);
 wait_slot_confirm_lsn 
-----------------------
 
(1 row)

\c :subscriber_dsn
SELECT * FROM public.funct;
 a | b 
---+---
 1 | 1
 2 | 2
 3 | 3
(3 rows)

-- test replication where the destination table has extra (nullable) columns that are not in the origin table
\c :provider_dsn
SELECT spock.replicate_ddl($$
CREATE TABLE public.nullcheck_tbl(
	id integer PRIMARY KEY,
	id1 integer,
	name text
) ;
$$);
 replicate_ddl 
---------------
 t
(1 row)

SELECT * FROM spock.repset_add_table('default', 'nullcheck_tbl');
 repset_add_table 
------------------
 t
(1 row)

SELECT spock.wait_slot_confirm_lsn(NULL, NULL);
 wait_slot_confirm_lsn 
-----------------------
 
(1 row)

INSERT INTO public.nullcheck_tbl(id,id1,name) VALUES (1,1,'name1');
INSERT INTO public.nullcheck_tbl(id,id1,name) VALUES (2,2,'name2');
SELECT spock.wait_slot_confirm_lsn(NULL, NULL);
 wait_slot_confirm_lsn 
-----------------------
 
(1 row)

\c :subscriber_dsn
SELECT * FROM public.nullcheck_tbl;
 id | id1 | name  
----+-----+-------
  1 |   1 | name1
  2 |   2 | name2
(2 rows)

ALTER TABLE public.nullcheck_tbl ADD COLUMN name1 text;
SELECT * FROM public.nullcheck_tbl;
 id | id1 | name  | name1 
----+-----+-------+-------
  1 |   1 | name1 | 
  2 |   2 | name2 | 
(2 rows)

\c :provider_dsn
INSERT INTO public.nullcheck_tbl(id,id1,name) VALUES (3,3,'name3');
INSERT INTO public.nullcheck_tbl(id,id1,name) VALUES (4,4,'name4');
SELECT spock.wait_slot_confirm_lsn(NULL, NULL);
 wait_slot_confirm_lsn 
-----------------------
 
(1 row)

\c :subscriber_dsn
SELECT * FROM public.nullcheck_tbl;
 id | id1 | name  | name1 
----+-----+-------+-------
  1 |   1 | name1 | 
  2 |   2 | name2 | 
  3 |   3 | name3 | 
  4 |   4 | name4 | 
(4 rows)

\c :provider_dsn
UPDATE public.nullcheck_tbl SET name='name31' where id = 3;
SELECT spock.wait_slot_confirm_lsn(NULL, NULL);
 wait_slot_confirm_lsn 
-----------------------
 
(1 row)

\c :subscriber_dsn
INSERT INTO public.nullcheck_tbl(id,id1,name) VALUES (6,6,'name6');
SELECT * FROM public.nullcheck_tbl;
 id | id1 |  name  | name1 
----+-----+--------+-------
  1 |   1 | name1  | 
  2 |   2 | name2  | 
  4 |   4 | name4  | 
  3 |   3 | name31 | 
  6 |   6 | name6  | 
(5 rows)

\c :provider_dsn
SELECT spock.replicate_ddl($$
CREATE TABLE public.not_nullcheck_tbl(
	id integer PRIMARY KEY,
	id1 integer,
	name text
) ;
$$);
 replicate_ddl 
---------------
 t
(1 row)

SELECT * FROM spock.repset_add_table('default', 'not_nullcheck_tbl');
 repset_add_table 
------------------
 t
(1 row)

SELECT spock.wait_slot_confirm_lsn(NULL, NULL);
 wait_slot_confirm_lsn 
-----------------------
 
(1 row)

\c :subscriber_dsn
ALTER TABLE public.not_nullcheck_tbl ADD COLUMN id2 integer not null;
-- disable now to use pg_logical_slot_get_changes() later
SELECT spock.sub_disable('test_subscription', true);
 sub_disable 
-------------
 t
(1 row)

-- Wait for the end of this operation
DO $$
BEGIN
    WHILE EXISTS (SELECT 1 FROM pg_replication_slots WHERE active = 'true')
	LOOP
    END LOOP;
END;$$;
\c :provider_dsn
SELECT quote_literal(spock.pg_current_xlog_location()) as curr_lsn
\gset
INSERT INTO public.not_nullcheck_tbl(id,id1,name) VALUES (1,1,'name1');
INSERT INTO public.not_nullcheck_tbl(id,id1,name) VALUES (2,2,'name2');
\c :subscriber_dsn
SELECT * FROM public.not_nullcheck_tbl;
 id | id1 | name | id2 
----+-----+------+-----
(0 rows)

INSERT INTO public.not_nullcheck_tbl(id,id1,name) VALUES (3,3,'name3');
ERROR:  null value in column "id2" of relation "not_nullcheck_tbl" violates not-null constraint
DETAIL:  Failing row contains (3, 3, name3, null).
SELECT * FROM public.not_nullcheck_tbl;
 id | id1 | name | id2 
----+-----+------+-----
(0 rows)

\c :provider_dsn
DO $$
BEGIN
	FOR i IN 1..300 LOOP
		IF (SELECT count(1) FROM pg_replication_slots WHERE active = false) THEN
			RETURN;
		END IF;
		PERFORM pg_sleep(0.1);
	END LOOP;
END;
$$;
SELECT data::json->'action' as action, CASE WHEN data::json->>'action' IN ('I', 'D', 'U') THEN data END as data FROM pg_logical_slot_get_changes((SELECT slot_name FROM pg_replication_slots), NULL, 1, 'min_proto_version', '4', 'max_proto_version', '5', 'startup_params_format', '1', 'proto_format', 'json', 'spock.replication_set_names', 'default') WHERE LENGTH(data) > 0;
 action |                                                data                                                 
--------+-----------------------------------------------------------------------------------------------------
 "S"    | 
 "B"    | 
 "I"    | {"action":"I","relation":["public","not_nullcheck_tbl"],"newtuple":{"id":1,"id1":1,"name":"name1"}}
 "C"    | 
(4 rows)

SELECT data::json->'action' as action, CASE WHEN data::json->>'action' IN ('I', 'D', 'U') THEN data END as data FROM pg_logical_slot_get_changes((SELECT slot_name FROM pg_replication_slots), NULL, 1, 'min_proto_version', '4', 'max_proto_version', '5', 'startup_params_format', '1', 'proto_format', 'json', 'spock.replication_set_names', 'default') WHERE LENGTH(data) > 0;
 action |                                                data                                                 
--------+-----------------------------------------------------------------------------------------------------
 "S"    | 
 "B"    | 
 "I"    | {"action":"I","relation":["public","not_nullcheck_tbl"],"newtuple":{"id":2,"id1":2,"name":"name2"}}
 "C"    | 
(4 rows)

\c :subscriber_dsn
SELECT spock.sub_enable('test_subscription', true);
 sub_enable 
------------
 t
(1 row)

ALTER TABLE public.not_nullcheck_tbl ALTER COLUMN id2 SET default 99;
\c :provider_dsn
DO $$
BEGIN
	FOR i IN 1..100 LOOP
		IF (SELECT count(1) FROM pg_replication_slots WHERE active = true) THEN
			RETURN;
		END IF;
		PERFORM pg_sleep(0.1);
	END LOOP;
END;
$$;
INSERT INTO public.not_nullcheck_tbl(id,id1,name) VALUES (4,4,'name4'); -- id2 will be 99 on subscriber
ALTER TABLE public.not_nullcheck_tbl ADD COLUMN id2 integer not null default 0;
INSERT INTO public.not_nullcheck_tbl(id,id1,name) VALUES (5,5,'name5'); -- id2 will be 0 on both
SELECT spock.wait_slot_confirm_lsn(NULL, NULL);
 wait_slot_confirm_lsn 
-----------------------
 
(1 row)

\c :subscriber_dsn
SELECT * FROM public.not_nullcheck_tbl;
 id | id1 | name  | id2 
----+-----+-------+-----
  4 |   4 | name4 |  99
  5 |   5 | name5 |   0
(2 rows)

\c :provider_dsn
SELECT spock.replicate_ddl($$
CREATE FUNCTION public.some_prime_numbers() RETURNS SETOF integer
	LANGUAGE sql IMMUTABLE STRICT LEAKPROOF
	AS $_$
  VALUES (2), (3), (5), (7), (11), (13), (17), (19), (23), (29), (31), (37), (41), (43), (47), (53), (59), (61), (67), (71), (73), (79), (83), (89), (97)
$_$;

CREATE FUNCTION public.is_prime_lt_100(integer) RETURNS boolean
    LANGUAGE sql IMMUTABLE STRICT LEAKPROOF
	AS $_$
  SELECT EXISTS (SELECT FROM public.some_prime_numbers() s(p) WHERE p = $1)
$_$;

CREATE DOMAIN public.prime AS integer
CONSTRAINT prime_check CHECK(public.is_prime_lt_100(VALUE));

CREATE TABLE public.prime_tbl (
	num public.prime NOT NULL,
	PRIMARY KEY(num)
);
$$);
 replicate_ddl 
---------------
 t
(1 row)

SELECT * FROM spock.repset_add_table('default', 'public.prime_tbl');
 repset_add_table 
------------------
 t
(1 row)

INSERT INTO public.prime_tbl (num) VALUES(17), (31), (79);
DELETE FROM public.prime_tbl WHERE num = 31;
SELECT spock.wait_slot_confirm_lsn(NULL, NULL);
 wait_slot_confirm_lsn 
-----------------------
 
(1 row)

\c :subscriber_dsn
SELECT num FROM public.prime_tbl;
 num 
-----
  17
  79
(2 rows)

\c :provider_dsn
\set VERBOSITY terse
SELECT spock.replicate_ddl($$
	DROP TABLE public.funct CASCADE;
	DROP SEQUENCE public.INSERT_SEQ;
	DROP TABLE public.funct2 CASCADE;
	DROP TABLE public.funct5 CASCADE;
	DROP FUNCTION public.get_curr_century();
	DROP FUNCTION public.add(integer, integer);
	DROP TABLE public.nullcheck_tbl CASCADE;
	DROP TABLE public.not_nullcheck_tbl CASCADE;
	DROP TABLE public.prime_tbl CASCADE;
	DROP DOMAIN public.prime;
	DROP FUNCTION public.is_prime_lt_100(integer);
	DROP FUNCTION public.some_prime_numbers();
$$);
NOTICE:  drop cascades to table funct membership in replication set default_insert_only
NOTICE:  drop cascades to table funct2 membership in replication set default_insert_only
NOTICE:  drop cascades to table funct5 membership in replication set default_insert_only
NOTICE:  drop cascades to table nullcheck_tbl membership in replication set default
NOTICE:  drop cascades to table not_nullcheck_tbl membership in replication set default
NOTICE:  drop cascades to table prime_tbl membership in replication set default
 replicate_ddl 
---------------
 t
(1 row)

--
-- REPAIR mode tests
-- Here, we may check correctness of REPAIR mode for a single backend only
--
SET spock.enable_ddl_replication = 'on';
SET spock.include_ddl_repset = 'on';
CREATE TABLE spoc152_1(x integer PRIMARY KEY);
INFO:  DDL statement replicated.
BEGIN;
  SELECT spock.repair_mode(true) \gset
  CREATE TABLE spoc152_2(x integer PRIMARY KEY); -- doesn't replicate DDL
  SELECT spock.repair_mode(false) \gset
  CREATE TABLE spoc152_3(x integer PRIMARY KEY); -- replicate DDL
INFO:  DDL statement replicated.
  SELECT spock.repair_mode(true) \gset
  CREATE TABLE spoc152_4(x integer PRIMARY KEY); -- doesn't replicate DDL
  -- Check subtransations: nothing here should be replicated.
  SAVEPOINT s1;
	CREATE TABLE spoc152_6(x integer PRIMARY KEY);
  RELEASE SAVEPOINT s1;
    CREATE TABLE spoc152_7(x integer PRIMARY KEY);
  SAVEPOINT s2;
    CREATE TABLE spoc152_8(x integer PRIMARY KEY);
  ROLLBACK TO SAVEPOINT s2;
  CREATE TABLE spoc152_9(x integer PRIMARY KEY);
END;
CREATE TABLE spoc152_5(x integer PRIMARY KEY); -- replicate DDL
INFO:  DDL statement replicated.
-- Should not see 'not replicated' DDL in this table
SELECT message FROM spock.queue WHERE message::text LIKE '%spoc152_%'
ORDER BY queued_at;
                                        message                                        
---------------------------------------------------------------------------------------
 "SET search_path TO \"$user\", public; CREATE TABLE spoc152_1(x integer PRIMARY KEY)"
 "SET search_path TO \"$user\", public; CREATE TABLE spoc152_3(x integer PRIMARY KEY)"
 "SET search_path TO \"$user\", public; CREATE TABLE spoc152_5(x integer PRIMARY KEY)"
(3 rows)

-- Wait for remote receiver
SELECT spock.wait_slot_confirm_lsn(NULL, NULL);
 wait_slot_confirm_lsn 
-----------------------
 
(1 row)

\c :subscriber_dsn
SELECT relname FROM pg_class WHERE relname LIKE '%spoc152_%'
ORDER BY relname COLLATE "C";
    relname     
----------------
 spoc152_1
 spoc152_1_pkey
 spoc152_3
 spoc152_3_pkey
 spoc152_5
 spoc152_5_pkey
(6 rows)

SELECT message FROM spock.queue WHERE message::text LIKE '%spoc152_%'
ORDER BY queued_at;
                                        message                                        
---------------------------------------------------------------------------------------
 "SET search_path TO \"$user\", public; CREATE TABLE spoc152_1(x integer PRIMARY KEY)"
 "SET search_path TO \"$user\", public; CREATE TABLE spoc152_3(x integer PRIMARY KEY)"
 "SET search_path TO \"$user\", public; CREATE TABLE spoc152_5(x integer PRIMARY KEY)"
(3 rows)

\c :provider_dsn
-- Cleanup and DROP messages check
DROP TABLE spoc152_1, spoc152_2, spoc152_3, spoc152_4, spoc152_5 CASCADE;
NOTICE:  drop cascades to table spoc152_1 membership in replication set default
NOTICE:  drop cascades to table spoc152_3 membership in replication set default
NOTICE:  drop cascades to table spoc152_5 membership in replication set default
RESET spock.enable_ddl_replication;
RESET spock.include_ddl_repset;
